{
  "event_id": "EVT-U2-2024-0847",
  "asset_id": "U2-CONDENSER-MAIN",
  "patterns": [
    {
      "pattern_id": "TSKR::FM-CND-AIR-INLEAK",
      "event_id": "EVT-U2-2024-0847",
      "asset_id": "U2-CONDENSER-MAIN",
      "target_type": "failure_mode",
      "target_id": "FM-CND-AIR-INLEAK",
      "component_id": "U2-CND-EXPANSION-JOINT-EXHAUST",
      "relation": "overlaps",
      "operator_family": "interval_interval",
      "mean_lag_hours": 204.1544,
      "std_lag_hours": 103.9952,
      "support": 0.6555,
      "confidence": 1.0,
      "matching_signal_ids": [
        "U2-PT-1847A",
        "U2-AIT-0341",
        "U2-TE-2201",
        "U2-VIB-7701",
        "U2-TE-5501"
      ],
      "anomaly_count": 7,
      "lag_consistency": 0.3,
      "source": "TSKRTemporalScorerV1",
      "window_start": "2024-06-30T12:00:00+00:00",
      "window_end": "2024-07-14T03:45:00+00:00",
      "duration_hours": 327.75,
      "expected_latency_min_hours": 48.0,
      "expected_latency_max_hours": 336.0,
      "observed_lag_hours": 204.1544,
      "latency_alignment_score": 1.0,
      "latency_violation_type": "none",
      "temporal_contradiction": false,
      "recurrence_count": 2,
      "recurrence_trend": "insufficient_data",
      "unresolved_recurrence_count": 0
    },
    {
      "pattern_id": "TSKR::FM-CND-TUBE-FOUL",
      "event_id": "EVT-U2-2024-0847",
      "asset_id": "U2-CONDENSER-MAIN",
      "target_type": "failure_mode",
      "target_id": "FM-CND-TUBE-FOUL",
      "component_id": "U2-CND-TUBE-BUNDLE-A",
      "relation": "overlaps",
      "operator_family": "interval_interval",
      "mean_lag_hours": 204.1544,
      "std_lag_hours": 103.9952,
      "support": 0.5855,
      "confidence": 1.0,
      "matching_signal_ids": [
        "U2-PT-1847A",
        "U2-AIT-0341",
        "U2-TE-2201",
        "U2-VIB-7701",
        "U2-TE-5501"
      ],
      "anomaly_count": 7,
      "lag_consistency": 0.3,
      "source": "TSKRTemporalScorerV1",
      "window_start": "2024-06-30T12:00:00+00:00",
      "window_end": "2024-07-14T03:45:00+00:00",
      "duration_hours": 327.75,
      "expected_latency_min_hours": 168.0,
      "expected_latency_max_hours": 720.0,
      "observed_lag_hours": 204.1544,
      "latency_alignment_score": 1.0,
      "latency_violation_type": "none",
      "temporal_contradiction": false,
      "recurrence_count": 1,
      "recurrence_trend": "insufficient_data",
      "unresolved_recurrence_count": 0
    },
    {
      "pattern_id": "TSKR::FM-CW-TEMP-RISE",
      "event_id": "EVT-U2-2024-0847",
      "asset_id": "U2-CONDENSER-MAIN",
      "target_type": "failure_mode",
      "target_id": "FM-CW-TEMP-RISE",
      "component_id": "U2-CND-WATERBOX-A",
      "relation": "overlaps",
      "operator_family": "interval_interval",
      "mean_lag_hours": 204.1544,
      "std_lag_hours": 103.9952,
      "support": 0.463,
      "confidence": 1.0,
      "matching_signal_ids": [
        "U2-PT-1847A",
        "U2-AIT-0341",
        "U2-TE-2201",
        "U2-VIB-7701",
        "U2-TE-5501"
      ],
      "anomaly_count": 7,
      "lag_consistency": 0.3,
      "source": "TSKRTemporalScorerV1",
      "window_start": "2024-06-30T12:00:00+00:00",
      "window_end": "2024-07-14T03:45:00+00:00",
      "duration_hours": 327.75,
      "expected_latency_min_hours": 0.0,
      "expected_latency_max_hours": 720.0,
      "observed_lag_hours": 204.1544,
      "latency_alignment_score": 1.0,
      "latency_violation_type": "none",
      "temporal_contradiction": false,
      "recurrence_count": 0,
      "recurrence_trend": "insufficient_data",
      "unresolved_recurrence_count": 0
    },
    {
      "pattern_id": "TSKR::FM-HVAC-DEGRAD",
      "event_id": "EVT-U2-2024-0847",
      "asset_id": "U2-CONDENSER-MAIN",
      "target_type": "failure_mode",
      "target_id": "FM-HVAC-DEGRAD",
      "component_id": "U2-HVAC-TURBINE-BAY-FAN-A",
      "relation": "overlaps",
      "operator_family": "interval_interval",
      "mean_lag_hours": 204.1544,
      "std_lag_hours": 103.9952,
      "support": 0.313,
      "confidence": 0.5969,
      "matching_signal_ids": [
        "U2-PT-1847A",
        "U2-AIT-0341",
        "U2-TE-2201",
        "U2-VIB-7701",
        "U2-TE-5501"
      ],
      "anomaly_count": 7,
      "lag_consistency": 0.3,
      "source": "TSKRTemporalScorerV1",
      "window_start": "2024-06-30T12:00:00+00:00",
      "window_end": "2024-07-14T03:45:00+00:00",
      "duration_hours": 327.75,
      "expected_latency_min_hours": 24.0,
      "expected_latency_max_hours": 120.0,
      "observed_lag_hours": 204.1544,
      "latency_alignment_score": 0.2987,
      "latency_violation_type": "too_slow",
      "temporal_contradiction": true,
      "recurrence_count": 0,
      "recurrence_trend": "insufficient_data",
      "unresolved_recurrence_count": 0
    },
    {
      "pattern_id": "TSKR::FM-CND-TUBE-LEAK",
      "event_id": "EVT-U2-2024-0847",
      "asset_id": "U2-CONDENSER-MAIN",
      "target_type": "failure_mode",
      "target_id": "FM-CND-TUBE-LEAK",
      "component_id": "U2-CND-TUBE-BUNDLE-A",
      "relation": "overlaps",
      "operator_family": "interval_interval",
      "mean_lag_hours": 204.1544,
      "std_lag_hours": 103.9952,
      "support": 0.4355,
      "confidence": 0.5598,
      "matching_signal_ids": [
        "U2-PT-1847A",
        "U2-AIT-0341",
        "U2-TE-2201",
        "U2-VIB-7701",
        "U2-TE-5501"
      ],
      "anomaly_count": 7,
      "lag_consistency": 0.3,
      "source": "TSKRTemporalScorerV1",
      "window_start": "2024-06-30T12:00:00+00:00",
      "window_end": "2024-07-14T03:45:00+00:00",
      "duration_hours": 327.75,
      "expected_latency_min_hours": 2.0,
      "expected_latency_max_hours": 48.0,
      "observed_lag_hours": 204.1544,
      "latency_alignment_score": 0.0,
      "latency_violation_type": "too_slow",
      "temporal_contradiction": true,
      "recurrence_count": 1,
      "recurrence_trend": "insufficient_data",
      "unresolved_recurrence_count": 0
    }
  ],
  "summary": {
    "has_temporal_support": true,
    "mode": "deterministic_v1",
    "n_patterns": 5,
    "n_supported_patterns": 5,
    "operator_family": "interval_interval",
    "anomaly_point_count": 7,
    "signal_count": 5,
    "avg_confidence": 0.8313,
    "top_supported_targets": [
      "FM-CND-AIR-INLEAK",
      "FM-CND-TUBE-FOUL",
      "FM-CW-TEMP-RISE"
    ]
  },
  "provenance": {
    "generated_by": "TSKRTemporalScorerV1",
    "run_id": "a1a8abf8-27a3-4135-b0a5-bca597ebd028",
    "generated_at": "2026-04-07T15:37:14Z"
  }
}