{
  "event_id": "E2026-01-23-001",
  "asset_id": "PUMP_A_01",
  "patterns": [
    {
      "pattern_id": "TSKR::FM_BEARING_WEAR",
      "event_id": "E2026-01-23-001",
      "asset_id": "PUMP_A_01",
      "target_type": "failure_mode",
      "target_id": "FM_BEARING_WEAR",
      "component_id": "CMP_BRG",
      "relation": "simultaneous",
      "operator_family": "interval_point",
      "mean_lag_hours": 0.0,
      "std_lag_hours": null,
      "support": 0.0,
      "confidence": 0.65,
      "source": "test_rca_orchestrator.py"
    }
  ],
  "summary": {
    "has_temporal_support": true,
    "mode": "fixture_stub",
    "n_patterns": 1
  },
  "provenance": {
    "generated_by": "test_rca_orchestrator.py",
    "generated_at": "2026-01-23T10:40:00Z"
  }
}